{
  "schema": "code-bench-site/2.0",
  "title": "Co-Evolution: cross-vendor review benchmark for coding agents",
  "generated_at": "2026-09-04T17:50:40Z",
  "harness": {
    "build_commit": "925242b58317e94911d0baa9a1c4968f163c2b9e",
    "build_tree_dirty": true,
    "swebench_commit": "7a21e05772954cc81471ae19d56f436cecf43c54",
    "dataset": "princeton-nlp/SWE-bench_Verified",
    "dataset_revision": "c104f840cc67f8b6eec6f759ebc8b2693d585d4a",
    "lock_file": "benchmarks/code/external-sources.lock.json",
    "conditions_file": "benchmarks/code/conditions.json",
    "runs_file": "benchmarks/code/runs.json"
  },
  "pricing": {
    "file": "benchmarks/code/pricing.json",
    "recorded_on": "2026-09-04",
    "models": {
      "gpt-5.6-sol": {
        "vendor": "openai",
        "input": 5.0,
        "cached_input": 0.5,
        "output": 30.0
      },
      "gpt-5.6-terra": {
        "vendor": "openai",
        "input": 2.0,
        "cached_input": 0.2,
        "output": 12.0
      },
      "gpt-5.6-luna": {
        "vendor": "openai",
        "input": 0.2,
        "cached_input": 0.02,
        "output": 1.2
      },
      "glm-5.3-flash": {
        "vendor": "zai",
        "input": 0.15,
        "cached_input": 0.03,
        "output": 0.5,
        "note": "Regular list price. A launch promotion (0.075 / 0.015 / 0.25) ran through 2026-09-09; the list rate is used so runs before and after it price the same."
      },
      "kimi-k3": {
        "vendor": "moonshot",
        "input": 3.0,
        "cached_input": 0.3,
        "output": 15.0
      }
    },
    "codex_total_only_split": {
      "cached_input": 0.7,
      "input": 0.2,
      "output": 0.1
    }
  },
  "statistics": {
    "interval": "Wilson score, 95%",
    "paired_test": "exact two-sided McNemar on discordant tasks",
    "bootstrap": {
      "levels": [
        "repo",
        "task",
        "seed"
      ],
      "draws": 2000,
      "rng_seed": 20260904,
      "interval": "percentile 2.5-97.5"
    },
    "rank": "Rank(UB): 1 + number of arms whose interval lower bound exceeds this upper bound",
    "module": "benchmarks/site/stats.py"
  },
  "suite": {
    "id": "swebench-verified-poc",
    "dataset": "princeton-nlp/SWE-bench_Verified",
    "split": "test",
    "task_count": 1,
    "subset_file": "benchmarks/code/subsets/swebench-verified-poc.json",
    "sampling": null,
    "difficulty_annotation": {
      "source": "datasets-server.huggingface.co rows API, field `difficulty`",
      "dataset": "princeton-nlp/SWE-bench_Verified",
      "revision": "c104f840cc67f8b6eec6f759ebc8b2693d585d4a",
      "fetched_on": "2026-09-04",
      "buckets": [
        "<15 min fix",
        "15 min - 1 hour",
        "1-4 hours",
        ">4 hours"
      ],
      "counts": {
        "<15 min fix": 1,
        "15 min - 1 hour": 0,
        "1-4 hours": 0,
        ">4 hours": 0
      },
      "note": "Human time-to-fix estimate shipped with SWE-bench Verified. A public field, not a gold patch or hidden test."
    },
    "instances": [
      {
        "instance_id": "pallets__flask-5014",
        "repo": "pallets/flask",
        "difficulty": "<15 min fix"
      }
    ]
  },
  "gold_canary": {
    "run_id": "gold-canary-20260831T130008Z",
    "report_file": "benchmarks/results/code/evaluation/gold.gold-canary-20260831T130008Z.json",
    "submitted": 1,
    "resolved": 1
  },
  "runs": [
    {
      "label": "poc-flask-5014",
      "suite": "swebench-verified-poc",
      "model_tier": "frontier",
      "publishable": true,
      "ran_by": "we ran it",
      "note": "One-task proof of concept: every arm executes end to end and reaches the official evaluator. Not a measurement. Its evaluator reports carry the label code-bench (the default before --label existed).",
      "evaluator_label": "code-bench",
      "registered": true,
      "models": {
        "claude": [
          "fable"
        ],
        "codex": [
          "gpt-5.6-sol"
        ],
        "glm": [
          "glm-5.3-flash"
        ],
        "single_shot": [
          "glm-5.3-flash",
          "kimi-k3"
        ],
        "kimi": [
          "kimi-k3"
        ]
      },
      "conditions_measured": [
        "A",
        "B",
        "C",
        "D",
        "E",
        "F",
        "G",
        "H",
        "I"
      ],
      "conditions_not_run": [
        "J",
        "K",
        "L",
        "M",
        "N",
        "O",
        "P"
      ],
      "harness_commit": null,
      "harness_dirty": null,
      "harness_recorded": false
    }
  ],
  "rows": [
    {
      "id": "A@poc-flask-5014",
      "condition": "A",
      "label": "fable-solo",
      "tier": "agentic",
      "mixed_tier": false,
      "run_label": "poc-flask-5014",
      "model_tier": "frontier",
      "description": "Fable investigates, edits, and tests once.",
      "declared_dispatches": {
        "claude": 1,
        "codex": 0,
        "glm": 0,
        "kimi": 0
      },
      "phases": [
        "fable-implement"
      ],
      "seeds": [
        1
      ],
      "measured": true,
      "attempted": true,
      "reports": [
        {
          "seed": 1,
          "evaluator_run_id": "code-bench-20260902T221122Z",
          "report_file": "benchmarks/results/code/evaluation/co-evolution-condition-A.code-bench-20260902T221122Z.json",
          "submitted": 1,
          "resolved": 1,
          "dataset_total_instances": 500
        }
      ],
      "per_task": [
        {
          "instance_id": "pallets__flask-5014",
          "repo": "pallets/flask",
          "difficulty": "<15 min fix",
          "seed": 1,
          "status": "resolved",
          "patch_applied": true,
          "fail_to_pass_passed": 1,
          "fail_to_pass_failed": 0,
          "pass_to_pass_failed": 0,
          "evidence": "benchmarks/results/code/evaluation/logs/run_evaluation/code-bench-20260902T221122Z/co-evolution-condition-A/pallets__flask-5014/report.json",
          "cell_dir": "benchmarks/results/code/runs/poc-flask-5014/pallets__flask-5014/A",
          "wall_seconds": 417,
          "cost_usd": 2.4518
        }
      ],
      "telemetry": {
        "claude_dispatches": 1,
        "claude_cost_usd": 2.4518,
        "claude_input_tokens": 42935,
        "claude_cached_tokens": 656749,
        "claude_output_tokens": 18823,
        "claude_wall_seconds": 417,
        "codex_phases": 0,
        "codex_wall_seconds": 0,
        "codex_tokens": 0,
        "codex_input_tokens": 0,
        "codex_cached_tokens": 0,
        "codex_output_tokens": 0,
        "codex_cost_usd": 0.0,
        "codex_cost_low_usd": 0.0,
        "codex_cost_high_usd": 0.0,
        "glm_calls": 0,
        "glm_cost_usd": 0.0,
        "kimi_calls": 0,
        "kimi_cost_usd": 0.0,
        "cells_linked": 1,
        "repair_cells": 0,
        "repair_inert_count": 0,
        "selection_cells": 0,
        "selection_apply_only": 0,
        "patch_not_applied": 0,
        "codex_cli_versions": [],
        "sandbox_modes": [
          "workspace-write"
        ],
        "single_shot_attempts": [],
        "total_wall_seconds": 417,
        "cost_precision": "exact",
        "cost_is_complete": true,
        "cost_usd": 2.4518,
        "cost_low_usd": 2.4518,
        "cost_high_usd": 2.4518,
        "cost_per_task": 2.4518,
        "cost_per_resolved": 2.4518,
        "tokens": 718507,
        "tokens_per_task": 718507,
        "wall_per_task": 417,
        "wall_p50": 417,
        "wall_p90": 417,
        "seconds_per_resolved": 417
      },
      "attempted_count": 1,
      "cells_expected": 1,
      "complete": true,
      "submitted": 1,
      "resolved": 1,
      "models": {
        "claude": "fable",
        "codex": "gpt-5.6-sol"
      },
      "effort": {
        "claude": [
          "medium"
        ],
        "codex": [
          "medium"
        ]
      },
      "seats": {},
      "configuration": "fable solo",
      "implementer": "fable",
      "reviewers": [],
      "pipeline": "fable implements",
      "provenance": {
        "ran_by": "we ran it",
        "publishable": true,
        "run_note": "One-task proof of concept: every arm executes end to end and reaches the official evaluator. Not a measurement. Its evaluator reports carry the label code-bench (the default before --label existed).",
        "registered": true,
        "evaluator_run_ids": [
          "code-bench-20260902T221122Z"
        ],
        "report_files": [
          "benchmarks/results/code/evaluation/co-evolution-condition-A.code-bench-20260902T221122Z.json"
        ],
        "harness_commit": null,
        "harness_dirty": null,
        "harness_recorded": false,
        "cli_versions": {},
        "sandbox_modes": [
          "workspace-write"
        ]
      },
      "reproduce": "CODE_BENCH_SUITE=swebench-verified-poc bash benchmarks/code/code-bench.sh run-canary --run-id poc-flask-5014 --models frontier \\\n  --conditions A --task-limit 1 --max-claude-dispatches 1\nbash benchmarks/code/code-bench.sh evaluate benchmarks/results/code/predictions/poc-flask-5014/A.jsonl --label poc-flask-5014\nbash benchmarks/site/aggregate.sh --suite swebench-verified-poc --run-label poc-flask-5014",
      "score": {
        "resolved": 1,
        "n": 1,
        "rate": 1.0,
        "wilson_low": 0.20654931437723745,
        "wilson_high": 1.0,
        "seeds": 1
      },
      "bootstrap": {
        "point": 1.0,
        "low": 1.0,
        "high": 1.0,
        "n_boot": 2000,
        "seed": 20260904,
        "levels": [
          "repo",
          "task",
          "seed"
        ],
        "tasks": 1,
        "repos": 1
      },
      "seed_summary": null,
      "rank_ub": 1
    },
    {
      "id": "B@poc-flask-5014",
      "condition": "B",
      "label": "cross-vendor-bounce",
      "tier": "agentic",
      "mixed_tier": false,
      "run_label": "poc-flask-5014",
      "model_tier": "frontier",
      "description": "Fable implements; Codex reviews and repairs the patch.",